{
  "exit_code": 0,
  "json_parse_status": "PARSED",
  "label": "baseline",
  "limitations": [
    "This records CBMC output for the captured bounded invocation only.",
    "A PASS_REPORTED_BY_CBMC value is not complete program correctness.",
    "This runner does not interpret the mathematical meaning of any status change."
  ],
  "outcome": "PASS_REPORTED_BY_CBMC",
  "properties": [
    {
      "description": "compute property",
      "property_id": "main.assertion.1",
      "status": "SUCCESS",
      "trace_present": false
    }
  ],
  "schema_version": "1.0",
  "semantic_authority": "NONE",
  "timed_out": false
}
